{
  "carried_concerns": [],
  "concern_history": [],
  "correction_history": [],
  "inter_pass_actions": [
    {
      "action_id": "FW-P2-01",
      "history_cursor": 7,
      "is_correction_action": false,
      "kind": "draw_stroke",
      "part": "shoulder_axis",
      "reason": null,
      "stage": "P2_primary_axes",
      "target_stroke_id": null
    },
    {
      "action_id": "FW-P2-02",
      "history_cursor": 8,
      "is_correction_action": false,
      "kind": "draw_stroke",
      "part": "pelvis_axis",
      "reason": null,
      "stage": "P2_primary_axes",
      "target_stroke_id": null
    },
    {
      "action_id": "FW-P2-03",
      "history_cursor": 9,
      "is_correction_action": false,
      "kind": "draw_stroke",
      "part": "arm_chain",
      "reason": null,
      "stage": "P2_primary_axes",
      "target_stroke_id": null
    },
    {
      "action_id": "FW-P2-04",
      "history_cursor": 10,
      "is_correction_action": false,
      "kind": "draw_stroke",
      "part": "near_arm_chain",
      "reason": null,
      "stage": "P2_primary_axes",
      "target_stroke_id": null
    }
  ],
  "inter_pass_correction_actions": [],
  "memory_policy": [
    "No prior stage review exists; begin from the stage contract and references.",
    "Runtime memory never invents artistic conclusions.",
    "Concern resolution must be stated by the Agent in a fresh review, not inferred by the runtime."
  ],
  "next_pass_index": 1,
  "previous_decision": null,
  "previous_remaining_concerns": [],
  "previous_reported_corrections": [],
  "previous_review_digest": null,
  "prior_review_count": 0,
  "reopen_context": null,
  "schema": "img2drawing.stage_pass_memory.v2",
  "stage": "P2_primary_axes",
  "state": "cold_start"
}