{
  "carried_concerns": [],
  "concern_history": [],
  "correction_history": [],
  "inter_pass_actions": [
    {
      "action_id": "R23-P6-L01",
      "history_cursor": 468,
      "is_correction_action": true,
      "kind": "delete_stroke",
      "part": null,
      "reason": "Hair silhouette must not own the face opening.",
      "stage": "P6_identity_finish",
      "target_stroke_id": "contour_hair_left"
    },
    {
      "action_id": "R23-P6-L02",
      "history_cursor": 469,
      "is_correction_action": true,
      "kind": "delete_stroke",
      "part": null,
      "reason": "Hair silhouette must not own the face opening.",
      "stage": "P6_identity_finish",
      "target_stroke_id": "contour_hair_right"
    },
    {
      "action_id": "R23-P6-L03",
      "history_cursor": 470,
      "is_correction_action": true,
      "kind": "delete_stroke",
      "part": null,
      "reason": "Hair mass needs grouped, selective ownership.",
      "stage": "P6_identity_finish",
      "target_stroke_id": "hair_mass_left"
    },
    {
      "action_id": "R23-P6-L04",
      "history_cursor": 471,
      "is_correction_action": true,
      "kind": "delete_stroke",
      "part": null,
      "reason": "Hair mass needs grouped, selective ownership.",
      "stage": "P6_identity_finish",
      "target_stroke_id": "hair_mass_right"
    },
    {
      "action_id": "R23-P6-03",
      "history_cursor": 472,
      "is_correction_action": false,
      "kind": "draw_stroke",
      "part": "face_opening_left",
      "reason": null,
      "stage": "P6_identity_finish",
      "target_stroke_id": null
    },
    {
      "action_id": "R23-P6-04",
      "history_cursor": 473,
      "is_correction_action": false,
      "kind": "draw_stroke",
      "part": "face_opening_right",
      "reason": null,
      "stage": "P6_identity_finish",
      "target_stroke_id": null
    },
    {
      "action_id": "R23-P6-05",
      "history_cursor": 474,
      "is_correction_action": false,
      "kind": "draw_stroke",
      "part": "jaw_chin_relation",
      "reason": null,
      "stage": "P6_identity_finish",
      "target_stroke_id": null
    },
    {
      "action_id": "R23-P6-06",
      "history_cursor": 475,
      "is_correction_action": false,
      "kind": "draw_stroke",
      "part": "hair_group_outer_left",
      "reason": null,
      "stage": "P6_identity_finish",
      "target_stroke_id": null
    },
    {
      "action_id": "R23-P6-07",
      "history_cursor": 476,
      "is_correction_action": false,
      "kind": "draw_stroke",
      "part": "hair_group_outer_right",
      "reason": null,
      "stage": "P6_identity_finish",
      "target_stroke_id": null
    },
    {
      "action_id": "R23-P6-08",
      "history_cursor": 477,
      "is_correction_action": false,
      "kind": "draw_stroke",
      "part": "hair_part_and_bang",
      "reason": null,
      "stage": "P6_identity_finish",
      "target_stroke_id": null
    },
    {
      "action_id": "R23-P6-09",
      "history_cursor": 478,
      "is_correction_action": false,
      "kind": "draw_stroke",
      "part": "eye_line_relation",
      "reason": null,
      "stage": "P6_identity_finish",
      "target_stroke_id": null
    },
    {
      "action_id": "R23-P6-10",
      "history_cursor": 479,
      "is_correction_action": false,
      "kind": "draw_stroke",
      "part": "near_eye_pupil",
      "reason": null,
      "stage": "P6_identity_finish",
      "target_stroke_id": null
    },
    {
      "action_id": "R23-P6-11",
      "history_cursor": 480,
      "is_correction_action": false,
      "kind": "draw_stroke",
      "part": "far_eye_pupil",
      "reason": null,
      "stage": "P6_identity_finish",
      "target_stroke_id": null
    },
    {
      "action_id": "R23-P6-12",
      "history_cursor": 481,
      "is_correction_action": false,
      "kind": "draw_stroke",
      "part": "nose_plane",
      "reason": null,
      "stage": "P6_identity_finish",
      "target_stroke_id": null
    },
    {
      "action_id": "R23-P6-13",
      "history_cursor": 482,
      "is_correction_action": false,
      "kind": "draw_stroke",
      "part": "mouth_relation",
      "reason": null,
      "stage": "P6_identity_finish",
      "target_stroke_id": null
    },
    {
      "action_id": "R23-P6-14",
      "history_cursor": 483,
      "is_correction_action": false,
      "kind": "draw_stroke",
      "part": "jacket_fold_shoulder",
      "reason": null,
      "stage": "P6_identity_finish",
      "target_stroke_id": null
    },
    {
      "action_id": "R23-P6-15",
      "history_cursor": 484,
      "is_correction_action": false,
      "kind": "draw_stroke",
      "part": "jacket_fold_waist",
      "reason": null,
      "stage": "P6_identity_finish",
      "target_stroke_id": null
    },
    {
      "action_id": "R23-P6-16",
      "history_cursor": 485,
      "is_correction_action": false,
      "kind": "draw_stroke",
      "part": "jacket_fold_hem",
      "reason": null,
      "stage": "P6_identity_finish",
      "target_stroke_id": null
    },
    {
      "action_id": "R23-P6-17",
      "history_cursor": 486,
      "is_correction_action": false,
      "kind": "draw_stroke",
      "part": "near_elbow_rounding",
      "reason": null,
      "stage": "P6_identity_finish",
      "target_stroke_id": null
    },
    {
      "action_id": "R23-P6-18",
      "history_cursor": 487,
      "is_correction_action": false,
      "kind": "draw_stroke",
      "part": "near_knee_rounding",
      "reason": null,
      "stage": "P6_identity_finish",
      "target_stroke_id": null
    },
    {
      "action_id": "R23-P6-19",
      "history_cursor": 488,
      "is_correction_action": false,
      "kind": "draw_stroke",
      "part": "rifle_suppressor",
      "reason": null,
      "stage": "P6_identity_finish",
      "target_stroke_id": null
    },
    {
      "action_id": "R23-P6-20",
      "history_cursor": 489,
      "is_correction_action": false,
      "kind": "draw_stroke",
      "part": "rifle_barrel",
      "reason": null,
      "stage": "P6_identity_finish",
      "target_stroke_id": null
    },
    {
      "action_id": "R23-P6-21",
      "history_cursor": 490,
      "is_correction_action": false,
      "kind": "draw_stroke",
      "part": "rifle_receiver",
      "reason": null,
      "stage": "P6_identity_finish",
      "target_stroke_id": null
    },
    {
      "action_id": "R23-P6-22",
      "history_cursor": 491,
      "is_correction_action": false,
      "kind": "draw_stroke",
      "part": "rifle_scope",
      "reason": null,
      "stage": "P6_identity_finish",
      "target_stroke_id": null
    },
    {
      "action_id": "R23-P6-23",
      "history_cursor": 492,
      "is_correction_action": false,
      "kind": "draw_stroke",
      "part": "rifle_stock_cutout",
      "reason": null,
      "stage": "P6_identity_finish",
      "target_stroke_id": null
    },
    {
      "action_id": "R23-P6-24",
      "history_cursor": 493,
      "is_correction_action": false,
      "kind": "draw_stroke",
      "part": "sling_edge",
      "reason": null,
      "stage": "P6_identity_finish",
      "target_stroke_id": null
    }
  ],
  "inter_pass_correction_actions": [
    {
      "action_id": "R23-P6-L01",
      "history_cursor": 468,
      "is_correction_action": true,
      "kind": "delete_stroke",
      "part": null,
      "reason": "Hair silhouette must not own the face opening.",
      "stage": "P6_identity_finish",
      "target_stroke_id": "contour_hair_left"
    },
    {
      "action_id": "R23-P6-L02",
      "history_cursor": 469,
      "is_correction_action": true,
      "kind": "delete_stroke",
      "part": null,
      "reason": "Hair silhouette must not own the face opening.",
      "stage": "P6_identity_finish",
      "target_stroke_id": "contour_hair_right"
    },
    {
      "action_id": "R23-P6-L03",
      "history_cursor": 470,
      "is_correction_action": true,
      "kind": "delete_stroke",
      "part": null,
      "reason": "Hair mass needs grouped, selective ownership.",
      "stage": "P6_identity_finish",
      "target_stroke_id": "hair_mass_left"
    },
    {
      "action_id": "R23-P6-L04",
      "history_cursor": 471,
      "is_correction_action": true,
      "kind": "delete_stroke",
      "part": null,
      "reason": "Hair mass needs grouped, selective ownership.",
      "stage": "P6_identity_finish",
      "target_stroke_id": "hair_mass_right"
    }
  ],
  "memory_policy": [
    "No prior stage review exists; begin from the stage contract and references.",
    "Runtime memory never invents artistic conclusions.",
    "Concern resolution must be stated by the Agent in a fresh review, not inferred by the runtime."
  ],
  "next_pass_index": 1,
  "previous_decision": null,
  "previous_remaining_concerns": [],
  "previous_reported_corrections": [],
  "previous_review_digest": null,
  "prior_review_count": 0,
  "reopen_context": null,
  "schema": "img2drawing.stage_pass_memory.v2",
  "stage": "P6_identity_finish",
  "state": "cold_start"
}