{
  "carried_concerns": [],
  "concern_history": [],
  "correction_history": [],
  "inter_pass_actions": [
    {
      "action_id": "FW-P4-01",
      "history_cursor": 19,
      "is_correction_action": false,
      "kind": "draw_stroke",
      "part": "face_hair_opening",
      "reason": null,
      "stage": "P4_structural_connections",
      "target_stroke_id": null
    },
    {
      "action_id": "FW-P4-02",
      "history_cursor": 20,
      "is_correction_action": false,
      "kind": "draw_stroke",
      "part": "cardigan_shoulder",
      "reason": null,
      "stage": "P4_structural_connections",
      "target_stroke_id": null
    },
    {
      "action_id": "FW-P4-03",
      "history_cursor": 21,
      "is_correction_action": false,
      "kind": "draw_stroke",
      "part": "elbow_transition",
      "reason": null,
      "stage": "P4_structural_connections",
      "target_stroke_id": null
    },
    {
      "action_id": "FW-P4-04",
      "history_cursor": 22,
      "is_correction_action": false,
      "kind": "draw_stroke",
      "part": "knee_transition",
      "reason": null,
      "stage": "P4_structural_connections",
      "target_stroke_id": null
    }
  ],
  "inter_pass_correction_actions": [],
  "memory_policy": [
    "No prior stage review exists; begin from the stage contract and references.",
    "Runtime memory never invents artistic conclusions.",
    "Concern resolution must be stated by the Agent in a fresh review, not inferred by the runtime."
  ],
  "next_pass_index": 1,
  "previous_decision": null,
  "previous_remaining_concerns": [],
  "previous_reported_corrections": [],
  "previous_review_digest": null,
  "prior_review_count": 0,
  "reopen_context": null,
  "schema": "img2drawing.stage_pass_memory.v2",
  "stage": "P4_structural_connections",
  "state": "cold_start"
}