{
  "carried_concerns": [
    "cranium outline is a borrowed ellipse, not this head's measured width",
    "eye line and facial centreline therefore sit inside the face instead of across the head"
  ],
  "concern_history": [
    {
      "decision": "revise",
      "pass_index": 1,
      "remaining_concerns": [
        "cranium outline is a borrowed ellipse, not this head's measured width",
        "eye line and facial centreline therefore sit inside the face instead of across the head"
      ],
      "review_digest": "55444b4fe5ce02272e6dc09965d784b054f268f095b7390fa8dc55558c43d8c3"
    }
  ],
  "correction_history": [
    {
      "pass_index": 1,
      "reported_corrections": [],
      "review_digest": "55444b4fe5ce02272e6dc09965d784b054f268f095b7390fa8dc55558c43d8c3"
    }
  ],
  "inter_pass_actions": [
    {
      "action_id": "EX-P1-R1",
      "history_cursor": 34,
      "is_correction_action": true,
      "kind": "replace_stroke",
      "part": "head_outline",
      "reason": "Pass 1 stood a borrowed narrow ellipse in for the cranium, which the P1 contract forbids. Replaced with the head outline measured on the subject: wider, centred right of where the ellipse sat, and asymmetric.",
      "stage": "P1_gesture",
      "target_stroke_id": "head_outline"
    }
  ],
  "inter_pass_correction_actions": [
    {
      "action_id": "EX-P1-R1",
      "history_cursor": 34,
      "is_correction_action": true,
      "kind": "replace_stroke",
      "part": "head_outline",
      "reason": "Pass 1 stood a borrowed narrow ellipse in for the cranium, which the P1 contract forbids. Replaced with the head outline measured on the subject: wider, centred right of where the ellipse sat, and asymmetric.",
      "stage": "P1_gesture",
      "target_stroke_id": "head_outline"
    }
  ],
  "memory_policy": [
    "Start the next pass by re-checking carried_concerns against fresh artifacts.",
    "inter_pass_actions are mechanical action provenance, not proof that a concern was solved.",
    "Do not infer resolved concerns by set subtraction or scores; the Agent must make a fresh visual judgement.",
    "Use correction history to avoid repeating an ineffective edit without changing observation strategy."
  ],
  "next_pass_index": 2,
  "previous_decision": "revise",
  "previous_remaining_concerns": [
    "cranium outline is a borrowed ellipse, not this head's measured width",
    "eye line and facial centreline therefore sit inside the face instead of across the head"
  ],
  "previous_reported_corrections": [],
  "previous_review_digest": "55444b4fe5ce02272e6dc09965d784b054f268f095b7390fa8dc55558c43d8c3",
  "prior_review_count": 1,
  "reopen_context": null,
  "schema": "img2drawing.stage_pass_memory.v2",
  "stage": "P1_gesture",
  "state": "revision_continuation"
}