{
  "carried_concerns": [],
  "concern_history": [],
  "correction_history": [],
  "inter_pass_actions": [
    {
      "action_id": "FW-P1-01",
      "history_cursor": 2,
      "is_correction_action": false,
      "kind": "draw_stroke",
      "part": "head_spine",
      "reason": null,
      "stage": "P1_gesture",
      "target_stroke_id": null
    },
    {
      "action_id": "FW-P1-02",
      "history_cursor": 3,
      "is_correction_action": false,
      "kind": "draw_stroke",
      "part": "support_leg",
      "reason": null,
      "stage": "P1_gesture",
      "target_stroke_id": null
    },
    {
      "action_id": "FW-P1-03",
      "history_cursor": 4,
      "is_correction_action": false,
      "kind": "draw_stroke",
      "part": "counterbalance_leg",
      "reason": null,
      "stage": "P1_gesture",
      "target_stroke_id": null
    }
  ],
  "inter_pass_correction_actions": [],
  "memory_policy": [
    "No prior stage review exists; begin from the stage contract and references.",
    "Runtime memory never invents artistic conclusions.",
    "Concern resolution must be stated by the Agent in a fresh review, not inferred by the runtime."
  ],
  "next_pass_index": 1,
  "previous_decision": null,
  "previous_remaining_concerns": [],
  "previous_reported_corrections": [],
  "previous_review_digest": null,
  "prior_review_count": 0,
  "reopen_context": null,
  "schema": "img2drawing.stage_pass_memory.v2",
  "stage": "P1_gesture",
  "state": "cold_start"
}